{
	"$schema": "https://schemas.pay-cex.io/api/v3/order/return.json",
	"returnId": "CPR-a87264592a6b4304be70882b7f24cd1e",
	"returnClientId": null,
	"returnClientTag": null,
	"createdAt": "2021-05-24T18:22:27.024159Z",
	"status": "WITHDRAWAL_PENDING",
	"risks": [],
	"userFeeFactor": "0.425",
	"currency": "BTC",
	"returnAddress": "xxxxxxxxxxxxxxxxxxxxxxxxxxxxxxxxxx"
}